{
  "id": "exam-room",
  "title": "Exam room",
  "moment": "A quiet pause before or after an exam",
  "focus": "Rest your attention on one concrete detail in the room",
  "durationSeconds": 180,
  "segments": [
    { "order": 1, "label": "Settle", "startSecond": 0, "endSecond": 30, "optional": false,
      "text": "You might let your attention rest on the quiet of the room for a moment." },
    { "order": 2, "label": "Notice", "startSecond": 30, "endSecond": 120, "optional": false,
      "text": "If you like, notice one concrete detail: the surface of the desk under your hands, the steady hush in the room, or the light from the window. You can let your attention stay with whichever you choose. If it feels okay, you might also notice the feeling of the air as you breathe, only if you want to." },
    { "order": 3, "label": "Choose", "startSecond": 120, "endSecond": 165, "optional": true,
      "text": "There is nothing you need to do here. You can stay with one detail, or let your attention move gently between them." },
    { "order": 4, "label": "Close", "startSecond": 165, "endSecond": 180, "optional": false,
      "text": "When you are ready, you can return to the menu." }
  ],
  "exit": { "language": "You can stop at any time and return to the menu.", "optional": true },
  "transcript": { "sameOrigin": true, "text": "You might let your attention rest on the quiet of the room for a moment. If you like, notice one concrete detail: the surface of the desk under your hands, the steady hush in the room, or the light from the window. You can let your attention stay with whichever you choose. If it feels okay, you might also notice the feeling of the air as you breathe, only if you want to. There is nothing you need to do here. You can stay with one detail, or let your attention move gently between them. When you are ready, you can return to the menu." },
  "audio": { "sameOrigin": true, "src": "assets/audio/exam-room.mp3", "format": "mp3" },
  "review": { "status": "approved", "reviewer": "student-and-mentor-approved" }
}
