{
  "id": "empty-classroom",
  "title": "Empty classroom",
  "moment": "A quiet pause in an empty room between things",
  "focus": "Notice one steady detail in the quiet room",
  "durationSeconds": 180,
  "segments": [
    { "order": 1, "label": "Settle", "startSecond": 0, "endSecond": 30, "optional": false,
      "text": "You might let your attention rest on the quiet of the empty room for a moment." },
    { "order": 2, "label": "Notice", "startSecond": 30, "endSecond": 120, "optional": false,
      "text": "If you like, notice one steady detail: the rows of desks, the surface of the table in front of you, or the light coming through the windows. You can let your attention rest on whichever you choose. If it feels okay, you might notice the air in the room, or the easy rhythm of your breathing, only if you want to." },
    { "order": 3, "label": "Choose", "startSecond": 120, "endSecond": 165, "optional": true,
      "text": "There is nothing you need to do here. You can stay with one detail, or let your attention move gently." },
    { "order": 4, "label": "Close", "startSecond": 165, "endSecond": 180, "optional": false,
      "text": "When you are ready, you can return to the menu." }
  ],
  "exit": { "language": "You can stop at any time and return to the menu.", "optional": true },
  "transcript": { "sameOrigin": true, "text": "You might let your attention rest on the quiet of the empty room for a moment. If you like, notice one steady detail: the rows of desks, the surface of the table in front of you, or the light coming through the windows. You can let your attention rest on whichever you choose. If it feels okay, you might notice the air in the room, or the easy rhythm of your breathing, only if you want to. There is nothing you need to do here. You can stay with one detail, or let your attention move gently. When you are ready, you can return to the menu." },
  "audio": { "sameOrigin": true, "src": "assets/audio/empty-classroom.mp3", "format": "mp3" },
  "review": { "status": "draft", "reviewer": "ai-draft-pending-student-rewrite" }
}
