{
  "id": "sports-field",
  "title": "Sports field",
  "moment": "A short reset before or after being on the field",
  "focus": "Notice one steady detail around you",
  "durationSeconds": 180,
  "segments": [
    { "order": 1, "label": "Settle", "startSecond": 0, "endSecond": 30, "optional": false,
      "text": "You might let your attention rest where you are for a moment." },
    { "order": 2, "label": "Notice", "startSecond": 30, "endSecond": 120, "optional": false,
      "text": "If you like, notice one steady detail: the feel of the ground under your shoes, the open shape of the sky, or the sounds that come and go across the field. You can let your attention rest on whichever you choose. If it feels okay, you might notice the air on your face, or the gentle rhythm of your own breathing, only if you want to." },
    { "order": 3, "label": "Choose", "startSecond": 120, "endSecond": 165, "optional": true,
      "text": "There is nothing you need to do here. You can stay with one detail, or let your attention drift gently." },
    { "order": 4, "label": "Close", "startSecond": 165, "endSecond": 180, "optional": false,
      "text": "When you are ready, you can return to the menu." }
  ],
  "exit": { "language": "You can stop at any time and return to the menu.", "optional": true },
  "transcript": { "sameOrigin": true, "text": "You might let your attention rest where you are for a moment. If you like, notice one steady detail: the feel of the ground under your shoes, the open shape of the sky, or the sounds that come and go across the field. You can let your attention rest on whichever you choose. If it feels okay, you might notice the air on your face, or the gentle rhythm of your own breathing, only if you want to. There is nothing you need to do here. You can stay with one detail, or let your attention drift gently. When you are ready, you can return to the menu." },
  "audio": { "sameOrigin": true, "src": "assets/audio/sports-field.mp3", "format": "mp3" },
  "review": { "status": "approved", "reviewer": "student-and-mentor-approved" }
}
